Author,Content,Date,Linked Messages,Message ID,ThreadTitle,Unnamed: 10,Unnamed: 11,Unnamed: 12,Unnamed: 6,Unnamed: 7,Unnamed: 8,Unnamed: 9,annotation_id,annotator,created_at,id,lead_time,sentiment,updated_at,Sentiment
andreamysk,"I believe that many people feel the same fear here. However, you were good at planning things and recovering what was necessary. I will focus on the pain that has accompanied me for years (as well as for you, from what I have read) and on the relativity of the pain that the SN may cause (however short, compared to a time measured in years). I try every day to visualize the sense of peace and relief in interrupting this state of suffering (like athletes visualize their performance before a race: it seems bullshit, but it works; visualize that state of peace, whenever you have the opportunity. .. the panic will not disappear, but you will give it less space: take it as a daily exercise).
I wish you all the best and relief.","Jul 16, 2024 at 9:27 AM",2586604,2598313,"For those planning to use SN, how are you overcoming any fear?",,,,,,,,998,1,2024-10-05T06:44:05.132760Z,992,31.29,suicide supportive,2024-10-05T06:44:05.132760Z,5
Mebius,"I feel like there is some element of impulsivity required for it to truly work, thats how i got the guts to attempt for real anyway.","Jul 16, 2024 at 9:30 AM",2598313,2598314,"For those planning to use SN, how are you overcoming any fear?",,,,,,,,999,1,2024-10-05T06:44:14.970688Z,993,9.267,no enough information,2024-10-05T06:44:14.970688Z,5
LifeQuitter,I want to know that I've died and that's most likely impossible.,"Jul 16, 2024 at 9:46 AM",,2598321,"For those planning to use SN, how are you overcoming any fear?",,,,,,,,1000,1,2024-10-05T06:44:21.009168Z,994,5.491,no enough information,2024-10-05T06:44:21.009168Z,5
EternalSummer,"One of the key things about making sn peaceful is taking a large dose of crushed rapid absorption benzo( oxazepam, diazepam(valium)), this will make you sleep before you even feel the sn kicking in.","Jul 16, 2024 at 10:37 AM",2586604,2598359,"For those planning to use SN, how are you overcoming any fear?",,,,,,,,1001,1,2024-10-05T06:44:30.975617Z,995,9.298,method,2024-10-05T06:44:30.975617Z,5
DOHARDTHINGS24,"I really hope that's true. I'm scared I'm not getting enough research, scared that desperation will make me stupid, they adhd will fuck up my memory, all of it. I'm gonna handwrite my whole plan, including a packing list, what to do when I get there, come up with a protocol & put on here for people to nitpick (in a good way). I'm worried the anxiety of fucking it up, the anxiety of having to rush it, the anxiety that it's necessary to tell some lies (about where I am etc, I'm not good at it & I hate doing it) the anxiety that I don't know all the ways I can be tracked (not just paranoia, my ex is still in my stuff…) that I'll be found too soon if he is tracking me, what the punishment will be, what damage I'll have done in the process. So many things in my control, so many things not. But the anxiety of SI is a big one as it's impossible to predict - I want this, I need this, I won't change my mind, but I have seen what SI is capable of achieving, even when it goes against your rational brain, it can just override. And that's scary. So I want the benzos to kick in quick, but also know that I'll be too drowsy to achieve much afterwards…aaahhhhh!!!!!","Jul 16, 2024 at 11:53 PM",2598359,2599053,"For those planning to use SN, how are you overcoming any fear?",,,,,,,,1002,1,2024-10-05T06:45:18.782698Z,996,47.123,"{""choices"":[""2 thoughts about killing yourself?"",""thinking about how you might do this?"",""started to work or did you intent to carry out this plan?"",""high risk""]}",2024-10-05T06:45:18.782698Z,3
Nigh,What about wearing gloves?,"Jul 16, 2024 at 11:59 PM",2588949,2599055,"For those planning to use SN, how are you overcoming any fear?",,,,,,,,1003,1,2024-10-05T06:45:22.744087Z,997,3.288,no enough information,2024-10-05T06:45:22.744087Z,5
divinemistress36,Oh thats a good idea,"Jul 17, 2024 at 12:04 AM",2599055,2599060,"For those planning to use SN, how are you overcoming any fear?",,,,,,,,1004,1,2024-10-05T06:45:25.570964Z,998,2.248,no enough information,2024-10-05T06:45:25.570964Z,5
kvsvenky100,"I'm finding it very difficult to get Benzodiazepines, so I'm thinking of using sleeping pills instead. Will they work as well for CTB?","Jul 16, 2024 at 5:51 AM",,2598127,Will sleeping pills work as well as Benzos for the SN method?,,,,,,,,1005,1,2024-10-05T06:45:35.427875Z,999,9.225,"{""choices"":[""done, started or prepared to do anything to end your life?"",""high risk"",""method""]}",2024-10-05T06:45:35.427875Z,3
Dayrain,Which ones are you talking about?,"Jul 16, 2024 at 6:28 AM",2598127,2598161,Will sleeping pills work as well as Benzos for the SN method?,,,,,,,,1006,1,2024-10-05T06:45:41.077591Z,1000,5.021,no enough information,2024-10-05T06:45:41.077591Z,5
kvsvenky100,"Zolpidem, Eszopiclone, Belsomra.","Jul 16, 2024 at 6:55 AM",2598161,2598180,Will sleeping pills work as well as Benzos for the SN method?,,,,,,,,1007,1,2024-10-05T06:45:44.618252Z,1001,2.934,method,2024-10-05T06:45:44.618252Z,5
ms-lovely,"I have a similar question but my option would be Quetiapine, wondering if that would work with SN.","Jul 16, 2024 at 11:45 PM",,2599047,Will sleeping pills work as well as Benzos for the SN method?,,,,,,,,1008,1,2024-10-05T06:45:50.095594Z,1002,4.79,method,2024-10-05T06:45:50.095594Z,5
kvsvenky100,"Nope, quetiapine doesn't work, it is not strong enough.","Jul 16, 2024 at 11:47 PM",2599047,2599050,Will sleeping pills work as well as Benzos for the SN method?,,,,,,,,1009,1,2024-10-05T06:45:53.924343Z,1003,3.193,method,2024-10-05T06:45:53.924343Z,5
ms-lovely,"Too bad, i've only had one once and i was out of it for a good while, i guess that just happened because im tiny and i wasn't used to it. I'm getting them from a friend since i don't have any prescriptions and thats the only thing available to me. Friday will be the day i CBT, i don't have time to figure something else out.","Jul 16, 2024 at 11:53 PM",2599050,2599052,Will sleeping pills work as well as Benzos for the SN method?,,,,,,,,1010,1,2024-10-05T06:46:16.774366Z,1004,22.187,"{""choices"":[""2 thoughts about killing yourself?"",""thoughts and some intention of acting on them?"",""started to work or did you intent to carry out this plan?"",""done, started or prepared to do anything to end your life?"",""high risk""]}",2024-10-05T06:46:16.774366Z,3
-nobodyknows-,"Nine years.

I worked on myself for nine years so that one day I could tell the person who kept me from killing myself that I had reached the point they said I would.

I had three goals: get off medication, make friends, and have faith in God.

I got to that point. I tried telling them today. They still won't speak to me.

I don't blame them. I was an ass to them all those years ago, and eventually they just stopped talking to me.

Now it feels pointless. I wanted to be able to tell them that. I don't need to be friends with them again or anything, but I needed to hear them say ""I told you so"".

I can't stand this. It's driving me crazy. I don't know what to do. The one single reason why I bothered trying will not happen. It's beyond disappointing.

I hate myself so fucking much.","Jul 13, 2024 at 3:02 AM",,2594661,My reason for trying to recover just went out the window,,,,,,,,1011,1,2024-10-05T06:46:45.383603Z,1005,27.992,no enough information,2024-10-05T06:46:45.383603Z,5
kyhoti,"Well, I'm proud of you for your hard work. Recovery of any type is tough. Good on ya!","Jul 13, 2024 at 3:50 AM",,2594681,My reason for trying to recover just went out the window,,,,,,,,1012,1,2024-10-05T06:46:50.793282Z,1006,4.684,supportive,2024-10-05T06:46:50.793282Z,5
AgentAlaniKelso,"But look at all the good you've done for yourself, even if that wasn't your original motivation. You got off meds, you've made friends, and you've found your faith. YOU did that, you put in the work. I challenge you to look deep within and recognize the work you've done is really for YOU, not for anyone else. I know a great big ""fuck you"" would feel great. But will that change anything? Your ""fuck you"" to this person is living well - off meds, with friends, and with your faith. Fuck that person. You made it this far without them/despite of them. I AM PROUD OF YOU.","Jul 16, 2024 at 11:33 PM",,2599035,My reason for trying to recover just went out the window,,,,,,,,1013,1,2024-10-05T06:47:01.734775Z,1007,10.309,supportive,2024-10-05T06:47:01.734775Z,5
LifeIsBS,"hello, i have seen other threads with this same request and i am sorry i am making a new thread, but i found that member account needs to be old to be trustworthy. so could anyone buy from a trusted known source and help ship sn to me? or is there a way i could prove that i am not gonna tell authorities? i have been on this site for several months but recently made an account because i am thinking of changing my preferred method from partial to SN but i don't have sources, i have looked online but no luck. but if i can't find it in next few days then i will have to go with partial which i am not sure i could pull off. please help.","Jun 1, 2024 at 10:10 PM",,2544950,"SN source in india please, its fine if you can't directly share the sources",,,,,,,,1014,1,2024-10-05T06:47:21.989415Z,1008,19.585,"{""choices"":[""done, started or prepared to do anything to end your life?"",""high risk"",""method""]}",2024-10-05T06:47:21.989415Z,3
sugarh1gh,"Yeah, you are fairly new (I mean, who am I to speak). But people here really don't give out the sources because it is dangerous.
Genuinely, we don't want to be associated with assistance and I heard you could get banned.
And there was quite few times where authorities connected people who ctb to this forum.
You would have to stick around for some time, connecting with other people.
I am sorry that's all I could say. I am in the same place as you, and it is devastating to not know the source.
But I can assure you someone will help you as long as you are sticking around.

And even if you have the source (I don't know where you live) and order SN, it would probably not arrive in next couple of days.","Jun 1, 2024 at 10:31 PM",,2544960,"SN source in india please, its fine if you can't directly share the sources",,,,,,,,1015,1,2024-10-05T06:47:47.615455Z,1009,24.994,method,2024-10-05T06:47:47.615455Z,5
LifeIsBS,"@sugarh1gh hey, really appreciate the reply. i understand. i would be going with partial then unless i back out again, then i might have to wait for SN, but sooner the better.","Jun 2, 2024 at 2:34 AM",,2545103,"SN source in india please, its fine if you can't directly share the sources",,,,,,,,1016,1,2024-10-05T06:48:03.979607Z,1010,15.785,"{""choices"":[""done, started or prepared to do anything to end your life?"",""high risk""]}",2024-10-05T06:48:03.979607Z,3
sugarh1gh,"I wish you the very best.
Hope you find the eternal peace.","Jun 2, 2024 at 5:07 AM",2545103,2545244,"SN source in india please, its fine if you can't directly share the sources",,,,,,,,1017,1,2024-10-05T06:48:09.416075Z,1011,4.778,suicide supportive,2024-10-05T06:48:09.416075Z,5
kvsvenky100,I could give you the source if you want.,"Jul 16, 2024 at 10:02 AM",,2598335,"SN source in india please, its fine if you can't directly share the sources",,,,,,,,1018,1,2024-10-05T06:48:15.728191Z,1012,5.681,method,2024-10-05T06:48:15.728191Z,5
icetealatte,Is it any source other than jm or sd sources?,"Jul 16, 2024 at 11:47 AM",2598335,2598433,"SN source in india please, its fine if you can't directly share the sources",,,,,,,,1019,1,2024-10-05T06:48:19.691399Z,1013,3.33,method,2024-10-05T06:48:19.691399Z,5
kvsvenky100,What do you mean by jm and sd?,"Jul 16, 2024 at 11:25 PM",,2599031,"SN source in india please, its fine if you can't directly share the sources",,,,,,,,1020,1,2024-10-05T06:48:23.124780Z,1014,2.866,no enough information,2024-10-05T06:48:23.124780Z,5
ambivalent_thespian,"I objectively know that I have people who would care if I wasn't here anymore. I live with my parents, and they do feel somewhat of a desire to care for me. My little brother is autistic, so I doubt he'd understand the concept of grief, which isn't really his fault at all.

I have a best friend, and we're still in regular contact. I could text her right now even because I know she's still up. She works at a restaurant on the weekends and her boyfriend is a pissbaby but I'll tolerate him to keep her happy.

I might be getting back with my ex girlfriend. We have a date planned for this Saturday. We're going to the aquarium because I felt jealous of some classmates who went without me back in June. She's really pretty but she's kind of awkward on phone calls.

We're in the digital age, and I'm a ""photogenic white girl"". I'm only 18, still a child in the eyes of some. It would be considered a tragedy instead of an inevitability. People would bring casseroles to my mother and my brother would forever be known as ""the kid whose sister killed herself"".

I read on here all the time about people who experienced homelessness. Who are estranged from their family. Going through marital problems. Those without the resources to receive proper help and even if they did, they lack a support system to help them follow through with their better habits, so they worry (or know) that they'll just fall back into the darkness.

People would cry at my hospital bed and I would tell them to leave.

Mounds and mounds of self hatred engulf me because I would actually rather die before I have an open and honest conversation with my mother about my 'feelings' or whatever. Or my father, grandmother, aunts, uncles, cousins and all those in between.

There are people whose parents aren't around anymore, or who can't contact them for fear of their own safety. And here I am being a little bitch about talking to mine.

People would kill for the life I have and I want to die living in mine.

I can objectively say that I have admirable traits. I think everyone does, even if you can't see them. Even if the bad outweighs the good. I can list things I admire about people whom I never wish to speak to again. People call me pretty and I don't think they're lying. People call me smart, funny, talented, thoughtful, kind, any and all of the above. Jack off to my instagram, why dontcha? Who fucking cared if I was 18 or 8 in those pictures?

I have everything I've ever wanted and I'm miserable!


I don't see myself as a virtuous person, I view myself as someone who just has some decency. A good person could never be anything like me and I can never figure out why.

The bar for being good is set so low these days that anyone who isn't an outright criminal might as well be nominated for sainthood.

I'm bad because I'm fucked in the head and I always have been. I'm bad because I'm a self entitled bitch. I'm bad because most religions fucking despise me. I'm bad because of things I can and cannot control.

I'm bad because a good person wouldn't keep staying in these bad situations when the way out is so goddamn simple.

I have a support system that I will not seek support from. I've never seen an adult psychologist and why even bother trying? The child ones were sucky enough to turn me off for life.

Am I gone too soon or did I remain too long? Can you prevent a chosen fate? Can a remedy be a tragedy if you don't believe that the end justifies the means?

And to what end?","Jul 16, 2024 at 10:36 PM",,2598985,Objectives and Subjectives,,,,,,,,1021,1,2024-10-05T06:49:50.142210Z,1015,86.316,"{""choices"":[""1 wish to be death?"",""low risk""]}",2024-10-05T06:49:50.142210Z,1
Topacio,"I have thought about it several times and I have come to the conclusion that the problem is life as such, if not existence.

Even having everything you can have, any comfort you can imagine. Something.... doesn't fit. It's a feeling of not belonging, something that makes everything the same.

A discomfort that only grows more and more.","Jul 16, 2024 at 11:20 PM",2598985,2599025,Objectives and Subjectives,,,,,,,,1022,1,2024-10-05T06:50:03.697186Z,1016,12.845,no enough information,2024-10-05T06:50:03.697186Z,5
CTB Dream,"This Injury damage unq this all unvrs ,8 bil 0 same","Jul 16, 2024 at 10:21 PM",,2598975,Me only,,,,,,,,1023,1,2024-10-05T06:50:13.290773Z,1017,09.01,no enough information,2024-10-05T06:50:13.290773Z,5
annointed_towers,"I know how you feel. I'm one of 8 billion people, too","Jul 16, 2024 at 10:41 PM",,2598991,Me only,,,,,,,,1024,1,2024-10-05T06:50:19.854976Z,1018,5.92,no enough information,2024-10-05T06:50:19.854976Z,5
_AllCatsAreGrey_,"A philosopher I like focused on the ambiguity of life. She pointed out the hard contrast between having the unique taste of our own mouths (our unique subjectivity) and also understanding ourselves also as an object to be crushed by the world (our objectivity).

In that we can understand our shared objectivity, but we'll never understand our unique subjectivity. @CTB Dream I'm happy to know you in the little way I can. I'm sad that we'll never be able to really know and understand each other.","Jul 16, 2024 at 10:44 PM",,2598995,Me only,,,,,,,,1025,1,2024-10-05T06:50:49.181435Z,1019,28.695,no enough information,2024-10-05T06:50:49.181435Z,5
Sulyya,"Not only are we all alone in our own minds but I'm sorry about your injury, making it even more lonely. You're appreciated here.","Jul 16, 2024 at 11:10 PM",,2599021,Me only,,,,,,,,1026,1,2024-10-05T06:50:57.953337Z,1020,8.138,supportive,2024-10-05T06:50:57.953337Z,5
SilverTiger,"Hello SaSu.

It has been one month since I have even looked at this site, this month has been exceptionally hard, I've got borderline personality disorder and each of the four weeks of this month I have had multiple episodes... I'm male and 26 for context.

I met someone on 4chan, talking about firearms and added him on discord at the start of the month, I have done quite odd sexual things with him, multiple times this month I have went on calls / text with him and ended up crying and screaming and begging for him to save me from myself. He had an ex with BPD so knows how to deal with me, but he has become my favourite person. I mean this when I say it, I truly believe it, I think he is god's gift to me, I basically made him my boyfriend, but I am paranoid he is going to abandon me, even though I now know where he lives, what he looks like and what his full name is. I still feel like he is going to walk away from

I go on alt-chans a lot, and I ended up meeting multiple older men there, where very interested in my self harm, I needed someone to talk to as I felt empty and in my infinite wisdom, I started to cut my wrists, so these older men could use me for sexual gratification, I begged and pleaded for them to stay with me and not toabandon me, as there was warm blood down my arms. I cut quite badly and ended up bleeding all over my shirts and desk so these men wouldn't leave me, but all three ended up ignoring me after finishing.

I went out with my Ph.D. supervisor, (no fault to him, hes a fantastic man) and he kept getting me ciders as I never had one before and it tasted fucking amazing, I kept drinking and drinking and drinking, and he saw my fresh self harm scars, and like a fucking idiot I told him I use to sexually roleplay with when I was 13 with older men over Skype / Omegle and now I am paranoid that he is going to ""care"" and report me for self harm and me being abused as a child, I don't care either of these happened I just didn't want anyone to know.

I was a fucking idiot and also told two friends I had, that I was assaulted as a child, I never wanted this to be found out by my friends, but these two people now know that I am fucked behind repair because of what my family did to me.

I fucked up really badly this month, and have paid the price for it in blood, new scars and letting people know more about me then I ever wanted them to.

Borderline is a person, someone who has known me since I was a child and someone who has his hands around my throat and is squeezing as hard as he can, I am not strong enough to fight him off.

The two people I told about what happened as a child, are now forcing me to go to therapy and get mood stabilizers, but I don't want this, I don't want to be the play thing of some strange psychiatrist woman or man.

4chan has a word for people like me ""BPDemons"" in reference to the damage we cause to others.

This has reinforced my will to die, not just for my sake, friends sake","Jun 30, 2024 at 3:27 PM",,2580524,Borderline and Updates,,,,,,,,1027,1,2024-10-05T06:52:59.769216Z,1021,127.982,"{""choices"":[""1 wish to be death?"",""low risk""]}",2024-10-05T06:53:08.320369Z,1
lharrywheel,i hope that you find your freedom.,"Jul 15, 2024 at 8:45 AM",,2597083,Borderline and Updates,,,,,,,,1028,1,2024-10-05T06:53:14.570977Z,1022,5.235,no enough information,2024-10-05T06:53:14.570977Z,5
helpmecatchthebus,BPD is the worst...,"Jul 16, 2024 at 10:57 PM",,2599011,Borderline and Updates,,,,,,,,1029,1,2024-10-05T06:53:17.327337Z,1023,2.067,no enough information,2024-10-05T06:53:17.327337Z,5
SalirDeLaMelancolía,"can someone help with a source? i attempted last year with SN already, (and unfortunately failed, but not due to the purity or quantity of the SN but rather being discovered), but the website i got it from took SN off of it's inventory, with my planning i had always been so confident in knowing where i could get it but now i can't and i feel helpless","Jul 1, 2024 at 11:28 PM",,2581956,U.S. SN source,,,,,,,,1030,1,2024-10-05T06:53:33.832492Z,1024,15.795,"{""choices"":[""done, started or prepared to do anything to end your life?"",""high risk"",""method""]}",2024-10-05T06:53:33.832492Z,3
notahappygirl,I'm looking for a source as well. I currently have N but I want to have SN as backup. How did you fail your attempt?,"Jul 1, 2024 at 11:33 PM",,2581962,U.S. SN source,,,,,,,,1031,1,2024-10-05T06:53:53.772300Z,1025,19.32,"{""choices"":[""done, started or prepared to do anything to end your life?"",""high risk"",""method""]}",2024-10-05T06:53:53.772300Z,3
SalirDeLaMelancolía,"i was found by family, i do think the SN would have been effective if not for that","Jul 1, 2024 at 11:37 PM",2581962,2581963,U.S. SN source,,,,,,,,1032,1,2024-10-05T06:54:05.287519Z,1026,29.035.000.000.000.000,"{""choices"":[""2 thoughts about killing yourself?"",""thinking about how you might do this?"",""done, started or prepared to do anything to end your life?"",""high risk""]}",2024-10-05T06:54:26.150333Z,3
notahappygirl,What were your symptoms before passing out ? And for how long were you unconscious,"Jul 1, 2024 at 11:47 PM",2581963,2581970,U.S. SN source,,,,,,,,1033,1,2024-10-05T06:54:33.839017Z,1027,5.854,no enough information,2024-10-05T06:54:33.839017Z,5
SalirDeLaMelancolía,"im not sure if you mean directly before passing out, but i'll start from when i first took it! directly after drinking it, i felt a lot of adrenaline, like i couldn't think of anything other than the fact that i just did what i did. my mind kind of drew a blank and i couldn't really lay down and just watch something or something like that. the first physical symptom i felt was this super warm acidy (?) feeling in my stomach, which again was directly after. i couldn't stop looking at my nails because it was a symptom i was very aware of beforehand, and i could actually see them turning blue, that symptom came fairly quickly, and im assuming my lips followed suit fairly soon after but i never got a chance to look at myself during the whole ordeal. then close to passing out i didn't really feel sleepy tired, i just felt drowsy-ish, if that makes sense. like weak rather than sleepy. and after that i passed out.","Jul 2, 2024 at 12:28 AM",,2581995,U.S. SN source,,,,,,,,1034,1,2024-10-05T06:55:10.970727Z,1028,40.049,"{""choices"":[""done, started or prepared to do anything to end your life?"",""high risk"",""method""]}",2024-10-05T06:55:34.424793Z,3
frost_,Can you describe any pain or discomfort you felt?,"Jul 2, 2024 at 12:32 AM",2581995,2581997,U.S. SN source,,,,,,,,1035,1,2024-10-05T06:55:14.947010Z,1029,3.293,no enough information,2024-10-05T06:55:14.947010Z,5
SalirDeLaMelancolía,"the ""acidy"" stomach part was pretty uncomfortable, and once i got to the hospital is was pure pain. like the worst pain i've probably ever felt in my life, and i was freezing cold, and seizing, and slipping in and out of consciousness, of course the SN took part in that, but i feel like i was only able to feel the pain because i was at the hospital and they were trying to keep me awake and alive. i believe SN is capable of being peaceful if you pass out with no disruption, at least i'm hoping. it was also very hard to breathe, i had to take very very long shallow and slow breaths and apparently i looked brown? or blue? im not sure what my parents described it as because they were there for the entire 2 hours, because it took 2 hours to get me stable and to throw up and everything. so yeah! afterwards i was very tired and then when i was in the ICU i was kind of crying to the doctor a little because of the pain i felt, i think it was in my stomach? and then i recovered physically soon after.","Jul 2, 2024 at 7:53 PM",2581997,2583015,U.S. SN source,,,,,,,,1036,1,2024-10-05T06:56:03.672132Z,1030,26.974,"{""choices"":[""done, started or prepared to do anything to end your life?"",""high risk"",""method""]}",2024-10-05T06:56:08.601223Z,3
pinkblur,i am looking for a source as well,"Jul 2, 2024 at 8:09 PM",,2583036,U.S. SN source,,,,,,,,1037,1,2024-10-05T06:56:12.487844Z,1031,2.761,method,2024-10-05T06:56:12.487844Z,5
teniralc21,Me also.,"Jul 3, 2024 at 9:27 PM",,2584392,U.S. SN source,,,,,,,,1038,1,2024-10-05T06:56:15.064485Z,1032,1.886,no enough information,2024-10-05T06:56:15.064485Z,5
