Author,Content,Date,Linked Messages,Message ID,ThreadTitle,Unnamed: 10,Unnamed: 11,Unnamed: 12,Unnamed: 6,Unnamed: 7,Unnamed: 8,Unnamed: 9,annotation_id,annotator,created_at,id,lead_time,sentiment,updated_at,Sentiment
LaVieEnRose,"Do you trust the competence of your therapist? A competent therapist isn't going to overreact the way you fear if you reveal these things to her. If you feel she will overreact then you don't trust her competence (no judgment there) but that also calls into question the utility of your work with her.
That's definitely your prerogative and your aversion is certainly understandable.","Jul 17, 2024 at 3:26 PM",2599059,2599718,I want help but I refuse to have my rights restricted...,,,,2599456,,,,337,1,2024-10-03T04:50:49.608297Z,331,58.191,supportive,2024-10-03T04:50:49.608297Z,5
lita-lassi,"if youre maybe interested in posting with others working towards recovery on ss, theres a very friendly ""id like to feel better"" thread pinned in recovery filled with lovely people. judgement-free zone where progress isnt linear and quite a few of us discuss our hesitations and frustrations with the various healthcare systems we're beholden to. we're quite welcome to anyone looking for ways to feel better or vent their agony just wanted to extend a friendly invite if you ever felt like being a little social with your recovery :)

edit: thats not to say people here arent just as lovely and helpful!","Jul 17, 2024 at 3:45 PM",,2599739,I want help but I refuse to have my rights restricted...,,,,,,,,338,1,2024-10-03T04:51:03.911780Z,332,13.747,supportive,2024-10-03T04:51:03.911780Z,5
findingquiet,"Perhaps give her some kind of indication you're already working to keep yourself safe - and perhaps even actually do something. Stash the ammo in a separate safe; write a list of non-CTB goals and attach it to that safe.

Then tell her something like ""I found myself with some hope and worried how I'd feel if I lost it again, and recognized that the guns represented a danger, so I took some steps to make anything like that harder for myself."" Tell her you don't think you're in imminent danger, and that you are coming into a sense of valuing your own life enough that you don't want the comfort of an easy out anymore.

Then tell her the steps you took with the ammo.","Jul 17, 2024 at 4:03 PM",,2599754,I want help but I refuse to have my rights restricted...,,,,,,,,339,1,2024-10-03T04:51:40.995225Z,333,36.5,supportive,2024-10-03T04:51:40.995225Z,5
AgentAlaniKelso,"I met with my therapist today and told her about my hesitation to share an issue that's been continuously bothering me. I then shared about some of the thoughts I've had, what seems to trigger them, and what I've done to mitigate/deescalate.

It went VERY well and she shared she knew I was safe and she believed I was not going to hurt myself. No reporting, no involuntary restrictions, nothing like that. She said she understood my hesitation but she was very glad I shared that I was struggling with this. She says she can help me. I am SO RELIEVED. This has been a problem for me for so long (decades) that I feel so much better even getting it off my chest. AND she can help me.

Thank you to everyone who commented and encouraged me to tell her. You were right and I truly thank you. It feels like the heavy weight of shame has just been pulled from my shoulders. Thank you.","Jul 17, 2024 at 4:59 PM",2599718,2599812,I want help but I refuse to have my rights restricted...,,,,,,,,340,1,2024-10-03T04:52:10.949829Z,334,29.329,no enough information,2024-10-03T04:52:10.949829Z,5
LaVieEnRose,"That's good. I am glad. Remember they primarily go by how you behave and what you say so if you can remain in control of yourself (certainly seems so) as well as not say blatantly alarming things (can do, right?) the risk of commitment is very, very low!","Jul 17, 2024 at 5:15 PM",2599812,2599830,I want help but I refuse to have my rights restricted...,,,,,,,,341,1,2024-10-03T04:52:18.304858Z,335,6.791,supportive,2024-10-03T04:52:18.304858Z,5
kyhoti,Way to go! That takes guts. My functioning pew-pews are all in a safe at a friends house (I think,"Jul 17, 2024 at 5:18 PM", he won't tell me where they are or let me go through them). That was my best solution to avoid impulsive action,2599832,I want help but I refuse to have my rights restricted...,,,, still sucks tho.,,,,342,1,2024-10-03T04:52:37.212337Z,336,18.309,no enough information,2024-10-03T04:52:37.212337Z,5
cherry7,I think it's about finding the people or person that can handle hearing about suicidal feelings without feeling the need to do anything. Mostly those will be older more experienced therapists and those who are not as traditional. I've had many hear me talk about it who had no concerns about it whatsoever. It really depends on what your therapist is like.,"Jul 28, 2024 at 12:18 AM",2599020,2611514,I want help but I refuse to have my rights restricted...,,,,,,,,343,1,2024-10-03T04:53:08.901866Z,337,31.004,supportive,2024-10-03T04:53:08.901866Z,5
needthebus,"they designed the system to be this way

you opt in or opt out","Jul 28, 2024 at 5:21 PM",2599020,2612371,I want help but I refuse to have my rights restricted...,,,,,,,,344,1,2024-10-03T04:53:14.333754Z,338,4.822,no enough information,2024-10-03T04:53:14.333754Z,5
4everHeartBroken,"I'm looking into partial hanging but before I can practice, I need to get over the fear of just simply loosing consciousness!
I've heard of the ""choking game"" and how people do this for fun (?!)
I just want to practice loosing consciousness ONLY, so when I'm ready to go, I can then tie off the rope and let gravity take its course while I'm unconscious.

I can press my carotid arteries but after a few seconds of some lightheadedness, I get too anxious and let my hands go off my neck. Then I get this AMAZING ENDORPHIN RUSH that feels sooooooooooo gooooood!!! But I'm too afraid to actually keep my hands on long enough to pass out. I've heard of people (even kids!) being able to do this again and again with no problem! I really need to get over this fear.

Has anyone had any success in simply loosing consciousness on your own?","Jun 29, 2024 at 4:47 PM",,2579371,How to make yourself LOOSE CONCIOUSNESS (the choking game?)?,,,,,,,,345,1,2024-10-03T04:54:18.908167Z,339,63.941,"{""choices"":[""2 thoughts about killing yourself?"",""thinking about how you might do this?"",""thoughts and some intention of acting on them?"",""high risk""]}",2024-10-03T04:54:18.908167Z,3
Living_Hurts_so_Much,"I don't want to spam, so I'll just say see my response on another of your posts.","Jul 9, 2024 at 3:04 PM",2579371,2590794,How to make yourself LOOSE CONCIOUSNESS (the choking game?)?,,,,,,,,346,1,2024-10-03T04:54:24.343203Z,340,4.807,no enough information,2024-10-03T04:54:24.343203Z,5
RamenNoodles,I'm interested in losing consciousness as well.,"Jul 9, 2024 at 3:06 PM",,2590795,How to make yourself LOOSE CONCIOUSNESS (the choking game?)?,,,,,,,,347,1,2024-10-03T04:54:32.408881Z,341,7.454,"{""choices"":[""2 thoughts about killing yourself?"",""low risk""]}",2024-10-03T04:54:32.408881Z,1
Living_Hurts_so_Much,From personal experience I say it was very easy to squeeze to the point of unconsciousness,"Jul 9, 2024 at 3:51 PM",2590795,2590836,How to make yourself LOOSE CONCIOUSNESS (the choking game?)?,,,,,,,,348,1,2024-10-03T04:54:50.510084Z,342,17.491,no enough information,2024-10-03T04:54:50.510084Z,5
RamenNoodles,I have tried and never lost consciousness.,"Jul 9, 2024 at 4:04 PM",,2590857,How to make yourself LOOSE CONCIOUSNESS (the choking game?)?,,,,,,,,349,1,2024-10-03T04:54:55.518291Z,343,4.388,no enough information,2024-10-03T04:54:55.518291Z,5
JustA_LittlePerson,"I used to be able to do it after I found out by accident tying a towel around my neck. I'd do it all the time if I could lol, it left a funny taste in my throat.","Jul 9, 2024 at 4:27 PM",,2590882,How to make yourself LOOSE CONCIOUSNESS (the choking game?)?,,,,,,,,350,1,2024-10-03T04:55:51.095568Z,344,54.972,no enough information,2024-10-03T04:55:51.095568Z,5
Living_Hurts_so_Much,"Interesting maybe I am just more susceptible to it, because it took a very short time.","Jul 9, 2024 at 4:44 PM",2590857,2590906,How to make yourself LOOSE CONCIOUSNESS (the choking game?)?,,,,,,,,351,1,2024-10-03T04:56:11.690732Z,345,19.975,no enough information,2024-10-03T04:56:11.690732Z,5
Illegal Preclear,"The ""choking game"" is actually one of my biggest inspirations for choosing hanging as my CTB method. Yeah! People not only do it for fun, but some get erotic pleasure out of it! David Carradine literally had an orgasmic hanging. Granted, that wasn't his goal but I wish everyone here who has chosen hanging could have that!

The ""choking game"" is mentioned in the Japanese Suicide Handbook (which I recommend EVERYONE read) - There was a Japanese doctor who was studying hanging to see EXACTLY what it felt like before you died (thank you for your service, doctor!) and he did it to the point of passing out to the point where his fellow doctors had to revive him - but according to this doctor it was very peaceful.

That being said - I think people respond to it differently. There are some people who will feel a rope around their neck and have an automatic panic response. And...there are some, as previously mentioned, who enjoy it to the point of being addicted to it.

As far as my experience goes - I practice with the rope I intend to use when the big day comes - I tie my hair to the side, put the noose right under the jawline, visualizing where the arteries that need closing are, hold the length of rope upward with my dominant hand and let my head hang loose, trying to simulate as close as possible to what the actual hanging will feel like. There's a 'pounding' type feeling that goes along with my pulse and I feel all the veins in my face going wild. I've never done it to the point of passing out, which I NEED to because I'm planning on swinging this September. I'm planning on practicing today again. Last time I decided to see if drinking a bunch of liquor would aid the process - bad idea. I gave myself such a huge migraine. But when I normally do it - the feeling is not exactly comfortable, but not that scary and I can see myself being able to do it until I pass out.

Also - I agree with OP in that the rush of endorphins you get after you let go feels REALLY COOL.","Jul 9, 2024 at 6:12 PM",,2590984,How to make yourself LOOSE CONCIOUSNESS (the choking game?)?,,,,,,,,352,1,2024-10-03T04:56:48.067077Z,346,35.748,"{""choices"":[""2 thoughts about killing yourself?"",""thinking about how you might do this?"",""thoughts and some intention of acting on them?"",""started to work or did you intent to carry out this plan?"",""high risk""]}",2024-10-03T04:56:48.067077Z,3
4everHeartBroken,"Hi LiveHurtsSoMuch,
I'm trying to find your response from another one of my posts, but I'm having a hard time finding it. It's probably just my lack of understanding. I'm so curious what you wrote but having trouble finding it.","Jul 17, 2024 at 5:13 PM",2590906,2599828,How to make yourself LOOSE CONCIOUSNESS (the choking game?)?,,,,2590794,,,,353,1,2024-10-03T04:56:59.406153Z,347,10.7,no enough information,2024-10-03T04:56:59.406153Z,5
lightturquoise,"my family lives on the opposite side of the country(us, 20 hour drive) and i'm sure they'll want to bury me close to them if i did ctb. i've heard a lot about how funerals and dead people stuff is very expensive in the us
i'm just wondering how bad it would be financially if they had to transport the body across. like i have some savings but idk if it would be enough.","Jul 17, 2024 at 12:29 AM",,2599076,would it financially ruin my family if i killed myself in a different state?,,,,,,,,354,1,2024-10-03T04:57:39.245671Z,348,39.275,"{""choices"":[""2 thoughts about killing yourself?"",""thinking about how you might do this?"",""medium risk""]}",2024-10-03T04:57:39.245671Z,2
3/4Dead,"Did a brief search; could be anywhere from $4 per mile to $5k or higher in total, depends on the funeral home and whether or not they [your family] plan to move the body themselves (I assume they would just have it transported, but hey some people get the permits and stuff do it). If you've got an idea of who will manage your burial (the funeral home or otherwise) you could reach out to them and inquire anon (it might also be on their website if they have one), if you're not sure specifically I'd say look into what's nearby your family that they may decide to use for transportation and burial to get a rough estimate. Hope this helped, and anyone please correct me if I got anything wrong, like I said, I only did a brief search.","Jul 17, 2024 at 5:03 PM",,2599817,would it financially ruin my family if i killed myself in a different state?,,,,,,,,355,1,2024-10-03T04:57:59.811138Z,349,19.899,no enough information,2024-10-03T04:57:59.811138Z,5
DEATH IS FREEDOM,"The survival instinct keeps life alive. The survival instinct does not want life to die. The society does not want humans to die. Global average life expectancy is 73 years. Humans are now living longer than ever before. The average lifespan of the ancient Greeks and Romans was 20 to 35 years. Modern medicine keeps people alive longer than our ancestors. People have jobs that do not wear out the body. Man has no other enemies than diseases and his fellow men. Human euthanasia is illegal in most countries. Many people think about suicide to avoid pointless suffering. But not everyone succeeds in dying by suicide because suicide is difficult and the body is not made to kill itself. However, if you do not die of suicide, there is the risk of dying of old age. Maybe there are people who want to die of old age, but I myself want to escape this terrible suffering with the ailments of old age and the decay of the body.

According to his papers, Mbah Ghoto in Indonesia, was born in December 1870. But Indonesia only started recording births in 1900. Mbah Ghoto survived four wives and all his children. In the last years of his life they had to wash him and feed him with spoon because he was getting weaker and weaker. Moreover, he could not stand upright because his back was bent. When Mbah Ghoto was 122 years old, he began to prepare for his death and made a tombstone. Mbah Ghoto waited for death for a very long time.

BBC NEWS: Oldest human dies in Indonesia aged 146","Nov 7, 2023 at 3:26 PM",,2228364,Oldest human died in Indonesia aged 146,,,,,,,,361,1,2024-10-03T04:59:11.605569Z,355,60.588,"{""choices"":[""1 wish to be death?"",""low risk""]}",2024-10-03T04:59:11.605569Z,1
SmollMushroom,"I can't even imagine living for that long...
Especially knowing that it must have been a struggle because of all the aches that aging brings.","Nov 7, 2023 at 3:34 PM",,2228377,Oldest human died in Indonesia aged 146,,,,,,,,362,1,2024-10-03T04:59:20.393535Z,356,8.173,no enough information,2024-10-03T04:59:20.393535Z,5
sserafim,"That's way too long for me. I can't even imagine being 25. My goal is to get out of here before I reach 25, it's my maximum exit point. I would hate to live to 146 and have to get old.","Nov 7, 2023 at 4:00 PM",2228364,2228404,Oldest human died in Indonesia aged 146,,,,,,,,363,1,2024-10-03T04:59:43.017243Z,357,22.092,"{""choices"":[""2 thoughts about killing yourself?"",""low risk""]}",2024-10-03T04:59:43.017243Z,1
Passersby,"Yeah me too. Theres no way I am going to let myself get to even half of that age. That's crazy and just plain silly. It's wrong and cruel for humans to have to live that long and put up with everything that goes with it. I too had a year/age where I had set a "" maximum exit point "" but unfortunately that day came and went and I'm still here. I tried to set a date for ctb a few times but it didn't work out either. We will have to make damn sure that we don't get even anywhere close to that age. As the years roll by it gets even more real and a time will eventually come where it will just have to end. I look forward to that day.","Nov 7, 2023 at 4:15 PM",2228404,2228431,Oldest human died in Indonesia aged 146,,,,,,,,364,1,2024-10-03T05:00:28.108228Z,358,44.48,"{""choices"":[""done, started or prepared to do anything to end your life?"",""medium risk""]}",2024-10-03T05:00:28.108228Z,2
FuneralCry,"That is so terrifying and horrifying. The thought of old age disturbs me so much, I see it as something to be avoided no matter what, I'd prefer to die than to be tormented in this existence for decades on end. Getting older is just undesirable, meaningless suffering,","Nov 7, 2023 at 4:55 PM",,2228488,Oldest human died in Indonesia aged 146,,,,,,,,365,1,2024-10-03T05:00:38.440516Z,359,9.591,no enough information,2024-10-03T05:00:38.440516Z,5
oneeyed,"I'm not 40 yet and I have spine issues, if I was 146 I would look like a pretzel.","Nov 7, 2023 at 5:16 PM",,2228516,Oldest human died in Indonesia aged 146,,,,,,,,366,1,2024-10-03T05:00:45.239768Z,360,6.251,no enough information,2024-10-03T05:00:45.239768Z,5
Lost cherry,Wow! Like turtle… i am only 27 and that is enough for me.,"Nov 7, 2023 at 5:46 PM",,2228552,Oldest human died in Indonesia aged 146,,,,,,,,367,1,2024-10-03T05:00:54.471577Z,361,8.625,"{""choices"":[""1 wish to be death?"",""low risk""]}",2024-10-03T05:00:54.471577Z,1
Kundalini Guy,He lived such a long time wow,"Nov 7, 2023 at 5:59 PM",,2228570,Oldest human died in Indonesia aged 146,,,,,,,,368,1,2024-10-03T05:00:59.021408Z,362,4.088,no enough information,2024-10-03T05:00:59.021408Z,5
sserafim,"Honestly, I never wanted to live past 18 but I never did anything about it so I inevitably did. I'll make sure to not live past 25 though. I won't let life and time pass me by again.","Nov 7, 2023 at 6:01 PM",2228431,2228573,Oldest human died in Indonesia aged 146,,,,,,,,369,1,2024-10-03T05:01:17.314483Z,363,17.699,"{""choices"":[""2 thoughts about killing yourself?"",""low risk""]}",2024-10-03T05:01:17.314483Z,1
deadtomorrow,"I don't get the appeal of living this long, even if you are healthy and have a good life.","Nov 7, 2023 at 6:18 PM",,2228589,Oldest human died in Indonesia aged 146,,,,,,,,370,1,2024-10-03T05:01:24.904133Z,364,6.991,no enough information,2024-10-03T05:01:24.904133Z,5
Passersby,I know how you feel. I won't either. I cant. So how old are you now? How much time do you have left until you reach your destination age of 25? Once my time came I wasn't able to go through with it for a few different reasons. Like you said though if I don't do anything about it and just let time pass things will just get worse and harder and it will never happen. So I have to take action.,"Nov 7, 2023 at 8:05 PM",2228573,2228698,Oldest human died in Indonesia aged 146,,,,,,,,371,1,2024-10-03T05:02:40.344690Z,365,74.815,no enough information,2024-10-03T05:02:40.344690Z,5
sserafim,"I'm 23 right now, so ~2 years to go. I'll probably end up ctb'ing before I reach 25 though. I think I'll probably go out soon because things in my life have gotten worse.","Nov 7, 2023 at 8:20 PM",2228698,2228711,Oldest human died in Indonesia aged 146,,,,,,,,372,1,2024-10-03T05:03:07.163160Z,366,26.168,"{""choices"":[""1 wish to be death?"",""2 thoughts about killing yourself?"",""thinking about how you might do this?"",""thoughts and some intention of acting on them?"",""high risk""]}",2024-10-03T05:03:07.163160Z,3
tiger b,Quality over quantity any day.,"Nov 8, 2023 at 1:44 PM",2228589,2229745,Oldest human died in Indonesia aged 146,,,,,,,,373,1,2024-10-03T05:03:11.752360Z,367,4.022,no enough information,2024-10-03T05:03:11.752360Z,5
Timelapse,"I feel what you are saying so much. I've had many CTB before 25 thoughts since the age of 12.

At first it was ""eat a frozen dinner every 2 days"", since I thought I would be homeless by 25, I gradually learned not wanting food no matter how much I needed it.

Isolation, self-loathing. I tried my first real CTB attempt at 22 years old. I ended up in the ICU. Woke up pissed off cursing the people around me. I tried many times since then. Now I'm 36 and I regret not CTB since the age of 12.","Nov 8, 2023 at 2:18 PM",2228573,2229781,Oldest human died in Indonesia aged 146,,,,,,,,374,1,2024-10-03T05:03:55.142041Z,368,42.8,"{""choices"":[""done, started or prepared to do anything to end your life?"",""medium risk""]}",2024-10-03T05:03:55.142041Z,2
Deleted member 65988,146 years is absolutely insane. This man lived well past two world wars for crying out loud.,"Nov 8, 2023 at 2:25 PM",,2229785,Oldest human died in Indonesia aged 146,,,,,,,,375,1,2024-10-03T05:04:13.661423Z,369,17.897,no enough information,2024-10-03T05:04:13.661423Z,5
busreservation92,Yeah and I just turned 132. Fake news.,"Nov 8, 2023 at 3:49 PM",,2229880,Oldest human died in Indonesia aged 146,,,,,,,,376,1,2024-10-03T05:04:16.761087Z,370,2.5,no enough information,2024-10-03T05:04:16.761087Z,5
ijustwishtodie,"I wish I could leave before I reach 25 too but with how pathetic I am, it's basically near impossible for me. Either way, regardless of what you do, I hope you find peace soon

To reply to op here: living up to 146 sounds extremely tiring. To go through this pointless existence for 100+ years will make me insane","Nov 8, 2023 at 9:25 PM",2228404,2230306,Oldest human died in Indonesia aged 146,,,,,,,,377,1,2024-10-03T05:04:40.497727Z,371,23.117,suicide supportive,2024-10-03T05:04:40.497727Z,5
jackrussell,that was interesting story. i don't know how people can made it to 65 years old.,"Nov 9, 2023 at 12:30 AM",,2230533,Oldest human died in Indonesia aged 146,,,,,,,,378,1,2024-10-03T05:04:45.996972Z,372,4.868,no enough information,2024-10-03T05:04:45.996972Z,5
lifeisbutadream,"He may have been that old, but the oldest proven age that any person has ever lived to is 122.","Nov 9, 2023 at 12:44 AM",,2230559,Oldest human died in Indonesia aged 146,,,,,,,,379,1,2024-10-03T05:04:52.194926Z,373,5.617,no enough information,2024-10-03T05:04:52.194926Z,5
lebrodude,"Yeah the claim he is that old is a bit dubious.
From the photos he is clearly very old but seems the claim can't be properly verified, which is a bit too convenient.","Nov 9, 2023 at 2:35 AM",,2230653,Oldest human died in Indonesia aged 146,,,,,,,,380,1,2024-10-03T05:04:57.024997Z,374,4.231,no enough information,2024-10-03T05:04:57.024997Z,5
peace_van,"Though most of us on SS may not relate, I feel he lived happily even in his final years, with his grandsons caring him.
In that case the longevity would be a good thing for him.

For me I would seek death whenever I find I cannot do the things I want to do now and in the future.
Can be caught into this situation any time in life, due to social constraints, disability, deteriorating body, etc.
It's meaningless to live on under the situation.","Nov 9, 2023 at 3:40 AM",,2230710,Oldest human died in Indonesia aged 146,,,,,,,,381,1,2024-10-03T05:05:47.491198Z,375,49.787,no enough information,2024-10-03T05:05:47.491198Z,5
deadtomorrow,"Humans can actually live to up to 400 years, seriously.","Nov 10, 2023 at 5:33 PM",2229880,2233196,Oldest human died in Indonesia aged 146,,,,,,,,382,1,2024-10-03T05:05:52.024609Z,376,3.914,no enough information,2024-10-03T05:05:52.024609Z,5
DEATH IS FREEDOM,Deliberately prolonging one´s life is a very slow and painful way to die.,"Nov 10, 2023 at 6:36 PM",,2233247,Oldest human died in Indonesia aged 146,,,,,,,,383,1,2024-10-03T05:06:00.291422Z,377,7.678,no enough information,2024-10-03T05:06:00.291422Z,5
tiger b,I'm curious. What conditions would allow this?,"Nov 10, 2023 at 6:38 PM",2233196,2233251,Oldest human died in Indonesia aged 146,,,,,,,,384,1,2024-10-03T05:06:06.026281Z,378,5.127,no enough information,2024-10-03T05:06:06.026281Z,5
riamu,"his age isn't verified tho, which is sus - it's also wayyy older than other record holders. jeanne calment also claimed a very old record but it's heavily disputed. I'm gonna stick with 'confirmed' records which say most extremely old people die around 120","Nov 10, 2023 at 6:57 PM",,2233267,Oldest human died in Indonesia aged 146,,,,,,,,385,1,2024-10-03T05:06:14.475847Z,379,7.843,no enough information,2024-10-03T05:06:14.475847Z,5
DEATH IS FREEDOM,"The human average life expectancy is increasing - we are expected to become demented and disabled - only to live as long as possible. Without suicide or euthanasia, this fate will befall most of us - but there is no dignity in slow dying. I want to die fast and with dignity.","May 11, 2024 at 11:12 AM",,2513601,Oldest human died in Indonesia aged 146,,,,,,,,386,1,2024-10-03T05:06:37.798750Z,380,22.76,"{""choices"":[""1 wish to be death?"",""low risk""]}",2024-10-03T05:06:37.798750Z,1
locked*n*loaded,I don't believe it.,"May 11, 2024 at 11:30 AM",,2513624,Oldest human died in Indonesia aged 146,,,,,,,,387,1,2024-10-03T05:06:40.910232Z,381,2.469,no enough information,2024-10-03T05:06:40.910232Z,5
Edpal247,I pity him. That is way too long with low quality,"Jul 17, 2024 at 4:48 PM",,2599801,Oldest human died in Indonesia aged 146,,,,,,,,388,1,2024-10-03T05:06:45.240017Z,382,3.597,no enough information,2024-10-03T05:06:45.240017Z,5
UnluckyBastard,"I know this is going to sound silly, but what if you just don't eat and drink pepto to cure the hunger pain? I haven't eaten all day today and I was wondering how long it would take to actually pass if this method is used. Starving to death itself is painful enough, but could pepto suppress the pain, making the process more bearable? What does everyone think?","Jul 17, 2024 at 3:39 PM",,2599732,Starving with Pepto bismaul?,,,,,,,,389,1,2024-10-03T05:07:13.806385Z,383,27.947,method,2024-10-03T05:07:13.806385Z,5
